chunk_id,priority,category,article,title,source,src_title,page_content
전세사기피해자 지원 및 주거안정에 관한 특별법(법률)(제21065호)(20260102)_020,1,"['보증금_대항력', '권리_정보리스크']",제25조의2(공공임대주택 지원),"전세사기 피해자와 특정 조건을 충족하는 임차인은 최장 10년간 공공임대주택을 우선 공급받을 수 있으며, 임대료 감면 혜택과 추가 거주 기간 연장이 가능하다.",전세사기피해자 지원 및 주거안정에 관한 특별법(법률)(제21065호)(20260102).docx,전세사기피해자 지원 및 주거안정에 관한 특별법(법률)(제21065호)(20260102),"① 공공주택사업자는 다음 각 호의 어느 하나에 해당하는 임차인에 대하여 공공임대주택(「공공주택 특별법」 제45조의2에 따라 기존주택을 임차하여 공공임대주택으로 공급하는 경우를 포함한다)을 우선 공급할 수 있고, 그 임차인은 최장 10년간 거주할 수 있다.

1. 제25조제1항에 따라 전세사기피해주택의 매입을 요청하였으나 그 주택을 공공임대주택으로 우선 공급받지 못한 전세사기피해자

2. 제2조제4호다목에 따른 임차인

② 공공주택사업자는 제1항에 따라 우선 공급된 공공임대주택의 임대료를 감면할 수 있으며, 이 경우 국가 또는 지방자치단체는 대통령령으로 정하는 바에 따라 감면된 임대료에 해당하는 비용을 재정으로 지원할 수 있다.

③ 전세사기피해자가 제1항에 따라 10년간 거주하였을 경우에는 「공공주택 특별법」 제49조에 따른 임대료 수준으로 해당 주택에 거주기간을 최장 10년간 연장할 수 있다.

④ 제2항에 따른 임대료 지원액의 총합은 전세사기피해자의 임차보증금에서 「주택임대차보호법」에 따라 대항력 또는 우선변제권을 행사하고 받은 금액과 임차보증금반환채권을 통하여 변제받은 금액을 제외한 금액을 넘을 수 없다.

⑤ 공공주택사업자에 대한 재정 지원에 필요한 사항은 대통령령으로 정하며, 제1항에 따른 공공임대주택의 공급기준, 임대조건 등에 필요한 사항은 국토교통부장관이 정하는 바에 따른다.

[본조신설 2024. 9. 10.]"
전세사기피해자 지원 및 주거안정에 관한 특별법(법률)(제21065호)(20260102)_021,1,"['분쟁해결', '권리_정보리스크']",제26조(경매 및 공매의 지원),"전세사기 피해자는 주택도시보증공사에 지원을 요청하면, 관련 법률에 따라 경매나 공매 절차를 지원받을 수 있다. 국가는 이러한 지원 비용의 일부를 주택도시기금에서 지원한다.",전세사기피해자 지원 및 주거안정에 관한 특별법(법률)(제21065호)(20260102).docx,전세사기피해자 지원 및 주거안정에 관한 특별법(법률)(제21065호)(20260102),"① 주택도시보증공사는 전세사기피해자의 신청을 받아 「민사집행법」 제78조 또는 같은 법 제264조에 따른 경매(「채무자 회생 및 파산에 관한 법률」 제496조제1항 또는 같은 법 제497조에 따라 환가하는 경우를 포함한다)나 「국세징수법」 제64조 또는 「지방세징수법」 제71조에 따른 매각절차와 관련하여 경매 및 공매의 지원서비스를 제공할 수 있다. <개정 2024. 9. 10.>

② 국가는 제1항에 따른 경매 및 공매의 지원서비스 제공에 필요한 비용의 일부를 「주택도시기금법」 제9조에 따라 지원할 수 있다."
전세사기피해자 지원 및 주거안정에 관한 특별법(법률)(제21065호)(20260102)_022,1,"['권리_정보리스크', '보증금_대항력']",제27조(금융지원 등),"전세사기 피해자와 임차인은 국가와 지방자치단체로부터 긴급 자금 지원 및 주택 융자를 받을 수 있으며, 신용정보 관리 기관은 해당 피해자들의 대출 불이행을 유예하거나 삭제할 수 있다. 또한, 피해자들은 주택저당채권 대상에 준주택(오피스텔 포함)도 포함된다.",전세사기피해자 지원 및 주거안정에 관한 특별법(법률)(제21065호)(20260102).docx,전세사기피해자 지원 및 주거안정에 관한 특별법(법률)(제21065호)(20260102),"① 국가 및 지방자치단체는 전세사기피해자 및 제2조제4호다목에 따른 임차인의 긴박한 주거안정을 보호하기 위하여 필요한 자금을 융자하거나 그 밖에 필요한 지원을 할 수 있다.

② 국가는 「주택임대차보호법」 제8조에 따른 우선변제를 받지 못하여 시급한 지원이 필요하다고 인정되는 전세사기피해자에게 주택도시기금에서 주택의 임대차에 필요한 자금을 융자할 수 있다.<개정 2024. 9. 10.>

③ 「한국자산관리공사 설립 등에 관한 법률」에 따른 금융회사등은 전세사기피해자등의 보증금이 모두 변제되지 아니한 경우 「신용정보의 이용 및 보호에 관한 법률」 제25조에 따른 신용정보집중기관이 같은 법 제26조의 신용정보집중관리위원회를 통하여 정한 기준에 따라 이들의 해당 전세 관련 대출에 대한 채무의 불이행 및 대위변제의 등록을 유예하거나 삭제할 수 있다.<개정 2024. 9. 10.>

④ 전세사기피해자 및 제2조제4호다목에 따른 임차인에 대하여는 「한국주택금융공사법」 제2조제3호의 주택저당채권대상에 「주택법」 제2조제4호에 따른 준주택 중 주거목적으로 사용되는 오피스텔을 포함한다.<신설 2024. 9. 10.>"
전세사기피해자 지원 및 주거안정에 관한 특별법(법률)(제21065호)(20260102)_023,1,['권리_정보리스크'],제28조(「긴급복지지원법」에 대한 특례),"전세사기 피해자와 그 가족은 긴급복지지원법에 따라 특별 지원 대상이 되어 필요한 지원을 받을 수 있습니다. 지원 기준, 기간, 종류 등은 해당 법률에 따라 결정됩니다.",전세사기피해자 지원 및 주거안정에 관한 특별법(법률)(제21065호)(20260102).docx,전세사기피해자 지원 및 주거안정에 관한 특별법(법률)(제21065호)(20260102),"① 전세사기피해자, 제2조제4호다목에 따른 임차인 또는 그 임차인(전세사기피해자를 포함한다)과 생계 및 주거를 같이 하고 있는 가구의 구성원은 「긴급복지지원법」 제5조에 따른 긴급지원대상자로 본다.

② 제1항에 따른 지원의 기준ㆍ기간ㆍ종류ㆍ방법 및 절차 등에 필요한 사항은 「긴급복지지원법」에 따른다."
전세사기피해자 지원 및 주거안정에 관한 특별법(법률)(제21065호)(20260102)_024,1,"['손해배상_책임', '계약갱신']",제33조(벌칙),"거짓 정보나 부정한 방법으로 지원을 받거나, 비밀 정보를 무단으로 사용하거나 누설하면 최대 5년 징역 또는 5억원 이하의 벌금에 처해집니다. 비밀 정보의 부적절한 이용은 최대 2년 징역 또는 2억원 이하의 벌금으로 처벌됩니다.",전세사기피해자 지원 및 주거안정에 관한 특별법(법률)(제21065호)(20260102).docx,전세사기피해자 지원 및 주거안정에 관한 특별법(법률)(제21065호)(20260102),"① 다음 각 호의 어느 하나에 해당하는 자는 5년 이하의 징역 또는 5천만원 이하의 벌금에 처한다. <개정 2024. 9. 10.>

1. 거짓이나 그 밖의 부정한 방법으로 이 법에 의한 지원을 받은 자

2. 제31조제1항을 위반하여 자료 또는 정보를 사용ㆍ제공 또는 누설한 자

② 제31조제2항을 위반하여 직무상 비밀을 누설하거나 직무수행 이외의 목적을 위하여 이용한 자는 2년 이하의 징역 또는 2천만원 이하의 벌금에 처한다."
전세사기피해자 지원 및 주거안정에 관한 특별법(법률)(제21065호)(20260102)_025,1,['기타'],제34조(과태료),"정당한 이유 없이 조사를 거부하거나 방해하고, 거짓 진술이나 자료를 제출한 사람은 최대 3천만원의 과태료를 부과받을 수 있습니다.",전세사기피해자 지원 및 주거안정에 관한 특별법(법률)(제21065호)(20260102).docx,전세사기피해자 지원 및 주거안정에 관한 특별법(법률)(제21065호)(20260102),"제13조에 따른 조사 또는 제14조제4항에 따른 추가 조사(제15조제3항에서 준용하는 경우를 포함한다)를 정당한 사유 없이 거부ㆍ방해ㆍ기피하거나 거짓의 진술서 또는 자료를 제출한 자에게는 3천만원 이하의 과태료를 부과한다.







부칙 <제21065호,2025. 10. 1.>(정부조직법)"
전세사기피해자 지원 및 주거안정에 관한 특별법(법률)(제21065호)(20260102)_026,1,['기타'],제1조(시행일),"이 법은 즉시 시행되지만, 일부 법률 개정 내용은 각각 정해진 날짜부터 시행됩니다. 특히, 특정 조항들은 2026년 1월 2일부터 시행되며, 다른 법률의 일부 개정 내용은 해당 법률의 시행일부터 순차적으로 적용됩니다.",전세사기피해자 지원 및 주거안정에 관한 특별법(법률)(제21065호)(20260102).docx,전세사기피해자 지원 및 주거안정에 관한 특별법(법률)(제21065호)(20260102),"이 법은 공포한 날부터 시행한다. 다만, 부칙 제7조에 따라 개정되는 법률 중 이 법 시행 전에 공포되었으나 시행일이 도래하지 아니한 법률을 개정한 부분은 각각 해당 법률의 시행일부터 시행하고, 다음 각 호의 개정규정은 해당 호에서 정하는 날부터 시행한다.

1. 다음 각 목의 개정규정은 2026년 1월 2일부터 시행한다. 다만, 부칙 제7조에 따라 개정되는 법률(가목 및 나목의 개정규정과 관련되는 부분으로 한정한다) 중 본문에 따른 시행일 전에 공포되었으나 본문에 따른 시행일이 도래하지 아니한 법률을 개정한 부분은 각각 해당 법률의 시행일부터 시행한다.

가. 제19조제4항, 제23조, 제29조제1항제1호 및 제30조의 개정규정

나. 제12조제2항, 제19조제3항, 제22조 및 제29조제2항 단서의 개정규정(재정경제부장관 및 재정경제부에 관한 부분으로 한정한다)

다. 부칙 제7조에 따라 개정되는 법률(가목 및 나목의 개정규정과 관련되는 부분으로 한정한다)



법제처



 

국가법령정보센터"
