chunk_id,priority,category,title,article,source,src_title,page_content
부동산 거래신고 등에 관한 법률(법률)(제20194호)(20240517)_000,1,['계약해지_명도'],부동산 거래신고 등에 관한 법률 부동산 거래신고 관련 법률,,부동산 거래신고 등에 관한 법률(법률)(제20194호)(20240517).docx,부동산 거래신고 등에 관한 법률(법률)(제20194호)(20240517),부동산 거래신고 등에 관한 법률
부동산 거래신고 등에 관한 법률(법률)(제20194호)(20240517)_001,1,['기타'],제1조 부동산 거래 신고 및 허가 관련 법률,1조,부동산 거래신고 등에 관한 법률(법률)(제20194호)(20240517).docx,부동산 거래신고 등에 관한 법률(법률)(제20194호)(20240517),제1조 (목적) 이 법은 부동산 거래 등의 신고 및 허가에 관한 사항을 정하여 건전하고 투명한 부동산 거래질서를 확립하고 국민경제에 이바지함을 목적으로 한다.
부동산 거래신고 등에 관한 법률(법률)(제20194호)(20240517)_002,1,"['계약해지_명도', '보증금_대항력', '임대료_증감']",제6조 주택 임대차 계약 신고 의무화,"2조, 6조",부동산 거래신고 등에 관한 법률(법률)(제20194호)(20240517).docx,부동산 거래신고 등에 관한 법률(법률)(제20194호)(20240517),"제6조 의2(주택 임대차 계약의 신고) ① 임대차계약당사자는 주택(「주택임대차보호법」 제2조에 따른 주택을 말하며, 주택을 취득할 수 있는 권리를 포함한다. 이하 같다)에 대하여 대통령령으로 정하는 금액을 초과하는 임대차 계약을 체결한 경우 그 보증금 또는 차임 등 국토교통부령으로 정하는 사항을 임대차 계약의 체결일부터 30일 이내에 주택 소재지를 관할하는 신고관청에 공동으로 신고하여야 한다. 다만, 임대차계약당사자 중 일방이 국가등인 경우에는 국가등이 신고하여야 한다.

② 제1항에 따른 주택 임대차 계약의 신고는 임차가구 현황 등을 고려하여 대통령령으로 정하는 지역에 적용한다.

③ 제1항에도 불구하고 임대차계약당사자 중 일방이 신고를 거부하는 경우에는 국토교통부령으로 정하는 바에 따라 단독으로 신고할 수 있다.

④ 제1항에 따라 신고를 받은 신고관청은 그 신고 내용을 확인한 후 신고인에게 신고필증을 지체 없이 발급하여야 한다.

⑤ 신고관청은 제1항부터 제4항까지의 규정에 따른 사무에 대한 해당 권한의 일부를 그 지방자치단체의 조례로 정하는 바에 따라 읍ㆍ면ㆍ동장 또는 출장소장에게 위임할 수 있다.

⑥ 제1항, 제3항 또는 제4항에 따른 신고 및 신고필증 발급의 절차와 그 밖에 필요한 사항은 국토교통부령으로 정한다.

[본조신설 2020. 8. 18.]"
부동산 거래신고 등에 관한 법률(법률)(제20194호)(20240517)_003,1,"['계약해지_명도', '보증금_대항력', '임대료_증감']",제6조 주택 임대차 계약 변경 및 해제 신고,6조,부동산 거래신고 등에 관한 법률(법률)(제20194호)(20240517).docx,부동산 거래신고 등에 관한 법률(법률)(제20194호)(20240517),"제6조 의3(주택 임대차 계약의 변경 및 해제 신고) ① 임대차계약당사자는 제6조의2에 따라 신고한 후 해당 주택 임대차 계약의 보증금, 차임 등 임대차 가격이 변경되거나 임대차 계약이 해제된 때에는 변경 또는 해제가 확정된 날부터 30일 이내에 해당 신고관청에 공동으로 신고하여야 한다. 다만, 임대차계약당사자 중 일방이 국가등인 경우에는 국가등이 신고하여야 한다.

② 제1항에도 불구하고 임대차계약당사자 중 일방이 신고를 거부하는 경우에는 국토교통부령으로 정하는 바에 따라 단독으로 신고할 수 있다.

③ 제1항에 따라 신고를 받은 신고관청은 그 신고 내용을 확인한 후 신고인에게 신고필증을 지체 없이 발급하여야 한다.

④ 신고관청은 제1항부터 제3항까지의 규정에 따른 사무에 대한 해당 권한의 일부를 그 지방자치단체의 조례로 정하는 바에 따라 읍ㆍ면ㆍ동장 또는 출장소장에게 위임할 수 있다.

⑤ 제1항부터 제3항까지의 규정에 따른 신고 및 신고필증 발급의 절차와 그 밖에 필요한 사항은 국토교통부령으로 정한다.

[본조신설 2020. 8. 18.]"
부동산 거래신고 등에 관한 법률(법률)(제20194호)(20240517)_004,1,"['손해배상_책임', '계약갱신']","제26조 - 부당한 신고 및 거짓 계약 위반 처벌
- 토지취득계약 관련 위반 처벌
- 토지거래계약 관련 위반 처벌
- 허가 취소 위반 처벌","3조, 4조, 9조, 11조, 21조, 26조",부동산 거래신고 등에 관한 법률(법률)(제20194호)(20240517).docx,부동산 거래신고 등에 관한 법률(법률)(제20194호)(20240517),"제26조 (벌칙) ① 부당하게 재물이나 재산상 이득을 취득하거나 제3자로 하여금 이를 취득하게 할 목적으로 제4조제4호 또는 제5호를 위반하여 거짓으로 제3조 또는 제3조의2에 따라 신고한 자는 3년 이하의 징역 또는 3천만원 이하의 벌금에 처한다. <신설 2023. 4. 18.>

② 제9조제1항에 따른 허가를 받지 아니하고 토지취득계약을 체결하거나 부정한 방법으로 허가를 받아 토지취득계약을 체결한 외국인등은 2년 이하의 징역 또는 2천만원 이하의 벌금에 처한다.<개정 2023. 4. 18.>

③ 제11조제1항에 따른 허가 또는 변경허가를 받지 아니하고 토지거래계약을 체결하거나, 속임수나 그 밖의 부정한 방법으로 토지거래계약 허가를 받은 자는 2년 이하의 징역 또는 계약 체결 당시의 개별공시지가에 따른 해당 토지가격의 100분의 30에 해당하는 금액 이하의 벌금에 처한다.<개정 2023. 4. 18.>

④ 제21조에 따른 허가 취소, 처분 또는 조치명령을 위반한 자는 1년 이하의 징역 또는 1천만원 이하의 벌금에 처한다.<개정 2023. 4. 18.>"
부동산 거래신고 등에 관한 법률(법률)(제20194호)(20240517)_005,1,['손해배상_책임'],제27조 양벌규정,"26조, 27조",부동산 거래신고 등에 관한 법률(법률)(제20194호)(20240517).docx,부동산 거래신고 등에 관한 법률(법률)(제20194호)(20240517),"제27조 (양벌규정) 법인의 대표자나 법인 또는 개인의 대리인, 사용인, 그 밖의 종업원이 그 법인 또는 개인의 업무에 관하여 제26조의 위반행위를 하면 그 행위자를 벌하는 외에 그 법인 또는 개인에게도 해당 조문의 벌금형을 과(科)한다. 다만, 법인 또는 개인이 그 위반행위를 방지하기 위하여 해당 업무에 관하여 상당한 주의와 감독을 게을리하지 아니한 경우에는 그러하지 아니하다.



부칙 <제20194호,2024. 2. 6.>(자연유산의 보존 및 활용에 관한 법률)"
부동산 거래신고 등에 관한 법률(법률)(제20194호)(20240517)_006,1,['기타'],제1조 법 시행일,1조,부동산 거래신고 등에 관한 법률(법률)(제20194호)(20240517).docx,부동산 거래신고 등에 관한 법률(법률)(제20194호)(20240517),제1조 (시행일) 이 법은 2024년 5월 17일부터 시행한다. <단서 생략>
부동산 거래신고 등에 관한 법률(법률)(제20194호)(20240517)_007,1,['계약해지_명도'],제2조 부동산 거래신고 등 법률 개정,2조,부동산 거래신고 등에 관한 법률(법률)(제20194호)(20240517).docx,부동산 거래신고 등에 관한 법률(법률)(제20194호)(20240517),"제2조 (다른 법률의 개정) ①부터 ④까지 생략

⑤ 법률 제19251호 부동산 거래신고 등에 관한 법률 일부를 다음과 같이 개정한다."
부동산 거래신고 등에 관한 법률(법률)(제20194호)(20240517)_008,1,['기타'],제9조 천연기념물등 지정 범위 변경,9조,부동산 거래신고 등에 관한 법률(법률)(제20194호)(20240517).docx,부동산 거래신고 등에 관한 법률(법률)(제20194호)(20240517),"제9조 제1항제2호의2 중 “천연기념물ㆍ명승 및 시ㆍ도자연유산”을 “천연기념물등”으로 한다.

⑥부터 ⑨까지 생략



법제처



 

국가법령정보센터"
