chunk_id,priority,category,title,article,source,src_title,page_content
지방세징수법(법률)(제20631호)(20250101)_000,5,['권리_정보리스크'],지방세징수법 지방세징수법,,지방세징수법(법률)(제20631호)(20250101).docx,지방세징수법(법률)(제20631호)(20250101),지방세징수법
지방세징수법(법률)(제20631호)(20250101)_001,5,"['권리_정보리스크', '행정절차', '보증금_대항력', '계약해지_명도']",제6조 **미납지방세 열람**,"2조, 6조",지방세징수법(법률)(제20631호)(20250101).docx,지방세징수법(법률)(제20631호)(20250101),"제6조 (미납지방세 등의 열람) ① 「주택임대차보호법」 제2조에 따른 주거용 건물 또는 「상가건물 임대차보호법」 제2조에 따른 상가건물을 임차하여 사용하려는 자(이하 이 조에서 “임차인”이라 한다)는 건물에 대한 임대차계약을 하기 전 또는 임대차계약을 체결하고 임대차기간이 시작되는 날까지 임대인의 동의를 받아 임대인이 납부하지 아니한 지방세의 열람을 지방자치단체의 장에게 신청할 수 있다. 이 경우 지방자치단체의 장은 열람신청에 응하여야 한다. <개정 2023. 3. 14.>

② 제1항에 따라 임차인이 열람할 수 있는 지방세는 다음 각 호의 어느 하나에 해당하는 지방세로 한정한다.<개정 2023. 3. 14.>

1. 임대인의 체납액

2. 납세고지서 또는 납부통지서를 발급한 후 납기가 되지 아니한 지방세

3. 지방세관계법에 따라 신고기한까지 신고한 지방세 중 납부하지 아니한 지방세

③ 제1항에도 불구하고 임차인이 체결한 임대차계약에 따른 보증금이 대통령령으로 정하는 금액을 초과하는 경우 임차인은 임대차기간이 시작되는 날까지 임대인의 동의 없이 제1항에 따른 열람신청을 할 수 있다. 이 경우 열람신청을 접수한 지방자치단체의 장은 지체 없이 열람 사실을 임대인에게 통지하여야 한다.<신설 2023. 3. 14.>

④ 제1항 및 제3항에 따른 열람신청에 필요한 사항은 대통령령으로 정한다.<개정 2023. 3. 14.>"
지방세징수법(법률)(제20631호)(20250101)_002,5,['권리_정보리스크'],제40조 압류금지 재산,"8조, 40조",지방세징수법(법률)(제20631호)(20250101).docx,지방세징수법(법률)(제20631호)(20250101),"제40조 (압류금지 재산) 다음 각 호의 재산은 압류할 수 없다.

13. 「주택임대차보호법」 제8조 및 같은 법 시행령에 따라 우선변제를 받을 수 있는 금액"
지방세징수법(법률)(제20631호)(20250101)_003,5,"['보증금_대항력', '분쟁해결', '계약해지_명도', '임대료_증감']",제81조 배분요구 절차 관련,"79조, 81조, 99조",지방세징수법(법률)(제20631호)(20250101).docx,지방세징수법(법률)(제20631호)(20250101),"제81조 (배분요구 등) ① 제79조에 따른 공매공고의 등기 또는 등록 전까지 등기되지 아니하거나 등록되지 아니한 다음 각 호의 채권을 가진 자는 제99조제1항에 따라 배분을 받으려면 배분요구의 종기까지 지방자치단체의 장에게 배분을 요구하여야 한다.

4. 「주택임대차보호법」 또는 「상가건물 임대차보호법」에 따라 우선변제권이 있는 임차보증금 반환채권

② 매각으로 소멸되지 아니하는 전세권을 가진 자가 배분을 받으려면 배분요구의 종기까지 배분을 요구하여야 한다.

③ 제1항 및 제2항에 따른 배분요구에 따라 매수인이 인수하여야 할 부담이 달라지는 경우 배분요구를 한 자는 배분요구의 종기가 지난 뒤에는 요구를 철회할 수 없다.

④ 지방자치단체의 장은 공매공고의 등기 또는 등록 전에 등기되거나 등록된 제1항 각 호의 채권을 가진 자(이하 “채권신고대상채권자”라 한다)로 하여금 채권의 유무, 그 원인 및 액수(원금, 이자, 비용, 그 밖의 부대채권을 포함한다)를 배분요구의 종기까지 지방자치단체의 장에게 신고하도록 최고하여야 한다.

⑤ 지방자치단체의 장은 채권신고대상채권자가 제4항에 따른 신고를 하지 아니할 때에는 등기사항증명서 등 공매 집행기록에 있는 증명자료에 따라 해당 채권신고대상채권자의 채권액을 계산한다. 이 경우 해당 채권신고대상채권자는 채권액을 추가할 수 없다."
지방세징수법(법률)(제20631호)(20250101)_004,5,"['권리_정보리스크', '보증금_대항력']",제99조 배분 방법,"81조, 97조, 99조",지방세징수법(법률)(제20631호)(20250101).docx,지방세징수법(법률)(제20631호)(20250101),"제99조 (배분 방법) ① 제97조제1항제2호 및 제3호의 금전은 다음 각 호의 체납액과 채권에 배분한다. 다만, 제81조제1항 및 제2항에 따라 배분요구의 종기까지 배분요구를 하여야 하는 채권의 경우에는 배분요구를 한 채권에 대해서만 배분한다.

4. 「주택임대차보호법」 또는 「상가건물 임대차보호법」에 따라 우선변제권이 있는 임차보증금 반환채권

② 제97조제1항제1호 및 제4호의 금전은 각각 그 압류 또는 교부청구에 관계되는 체납액에 충당한다.

③ 제1항과 제2항에 따라 금전을 배분하거나 충당하고 남은 금액이 있을 때에는 체납자에게 지급하여야 한다.

④ 지방자치단체의 장은 매각대금이 제1항 각 호의 체납액과 채권의 총액보다 적을 때에는 「민법」이나 그 밖의 법령에 따라 배분할 순위와 금액을 정하여 배분하여야 한다.

⑤ 지방자치단체의 장은 제1항에 따른 배분이나 제2항에 따른 충당을 할 때 지방세에 우선하는 채권이 있음에도 불구하고 배분 순위의 착오나 부당한 교부청구 또는 그 밖에 이에 준하는 사유로 체납액에 먼저 배분하거나 충당한 경우에는 그 배분하거나 충당한 금액을 지방세에 우선하는 채권자에게 지방세환급금 환급의 예에 따라 지급한다.



부칙 <제20631호,2024. 12. 31.>"
지방세징수법(법률)(제20631호)(20250101)_005,5,['기타'],제1조 법 시행일,1조,지방세징수법(법률)(제20631호)(20250101).docx,지방세징수법(법률)(제20631호)(20250101),제1조 (시행일) 이 법은 2025년 1월 1일부터 시행한다.
지방세징수법(법률)(제20631호)(20250101)_006,5,['분쟁해결'],제2조 매각결정 기일 연기 적용례,"2조, 92조",지방세징수법(법률)(제20631호)(20250101).docx,지방세징수법(법률)(제20631호)(20250101),제2조 (매각결정 기일의 연기에 관한 적용례) 제92조제2항의 개정규정은 이 법 시행 이후 공매공고를 하는 경우부터 적용한다.
지방세징수법(법률)(제20631호)(20250101)_007,5,['권리_정보리스크'],제3조 체납처분 중지 적용례,"3조, 104조",지방세징수법(법률)(제20631호)(20250101).docx,지방세징수법(법률)(제20631호)(20250101),"제3조 (체납처분의 중지에 관한 적용례) 제104조제3항의 개정규정은 이 법 시행 이후 체납처분의 집행을 중지하려는 경우부터 적용한다.



법제처



 

국가법령정보센터"
